{
  "$schema": "https://json-schema.org/draft/2020-12/schema",
  "$id": "https://frabcd.github.io/codex-ai-game-studio/schemas/recipe.schema.json",
  "title": "Codex AI Game Studio production recipe",
  "type": "object",
  "additionalProperties": false,
  "required": [
    "$schema",
    "schema_version",
    "id",
    "title",
    "description",
    "inputs",
    "ordered_stages",
    "required_capabilities",
    "expected_artifacts",
    "quality_gates",
    "fallbacks",
    "provenance_outputs",
    "mutation_policy"
  ],
  "properties": {
    "$schema": {
      "const": "https://frabcd.github.io/codex-ai-game-studio/schemas/recipe.schema.json"
    },
    "schema_version": {
      "const": "1.0.0"
    },
    "id": {
      "type": "string",
      "pattern": "^[a-z0-9]+(?:-[a-z0-9]+)*$"
    },
    "title": {
      "type": "string"
    },
    "description": {
      "type": "string"
    },
    "inputs": {
      "type": "array",
      "minItems": 1,
      "items": {
        "type": "string"
      },
      "uniqueItems": true
    },
    "ordered_stages": {
      "type": "array",
      "minItems": 2,
      "items": {
        "type": "object",
        "required": [
          "order",
          "id",
          "action"
        ],
        "properties": {
          "order": {
            "type": "integer",
            "minimum": 1
          },
          "id": {
            "type": "string"
          },
          "action": {
            "type": "string"
          }
        }
      }
    },
    "required_capabilities": {
      "type": "array",
      "minItems": 1,
      "items": {
        "type": "string"
      },
      "uniqueItems": true
    },
    "expected_artifacts": {
      "type": "array",
      "minItems": 1,
      "items": {
        "type": "string"
      }
    },
    "quality_gates": {
      "type": "array",
      "minItems": 7,
      "items": {
        "type": "object",
        "required": [
          "id",
          "description",
          "human_required"
        ],
        "properties": {
          "id": {
            "type": "string"
          },
          "description": {
            "type": "string"
          },
          "human_required": {
            "type": "boolean"
          }
        }
      }
    },
    "fallbacks": {
      "type": "array",
      "minItems": 1,
      "items": {
        "type": "string"
      }
    },
    "provenance_outputs": {
      "type": "array",
      "minItems": 1,
      "items": {
        "type": "string"
      },
      "uniqueItems": true
    },
    "mutation_policy": {
      "const": "plan-confirmed-digest-before-apply"
    }
  }
}
